{
  "schemaVersion": 2,
  "registryId": "ide-development-routing",
  "status": "active-policy-candidate",
  "routes": {
    "orchestrator": {
      "account": "cursor-001",
      "surface": "cursor-project",
      "cardinality": "one-per-repo",
      "modelClass": "frontier",
      "codesIssues": false
    },
    "codex-luna": {
      "provider": "codex-cli",
      "tier": "luna",
      "effort": "high",
      "modelResolution": "dispatch-time",
      "resolutionSource": "app-server model/list",
      "class": "everyday",
      "order": 1
    },
    "codex-sol": {
      "provider": "codex-cli",
      "tier": "sol",
      "effort": "medium",
      "modelResolution": "dispatch-time",
      "resolutionSource": "app-server model/list",
      "class": "hard",
      "order": 2
    },
    "cursor002-grok": {
      "provider": "cursor-api",
      "account": "cursor-002",
      "endpoint": "POST https://api.cursor.com/v1/agents",
      "family": "grok-4.7",
      "params": {
        "context": "500k",
        "reasoning_effort": "medium",
        "fast": "false"
      },
      "modelResolution": "dispatch-time",
      "resolutionSource": "GET /v1/models",
      "class": "everyday-overflow",
      "order": 3
    },
    "cursor002-opus": {
      "provider": "cursor-api",
      "account": "cursor-002",
      "endpoint": "POST https://api.cursor.com/v1/agents",
      "family": "claude-opus-5-5",
      "params": {
        "context": "1m",
        "effort": "medium",
        "fast": "false"
      },
      "forbiddenAliases": ["opus", "opus-latest"],
      "modelResolution": "dispatch-time",
      "resolutionSource": "GET /v1/models",
      "class": "hard-overflow",
      "order": 4
    }
  },
  "allowance": {
    "threshold": 75,
    "windows": ["primary", "secondary"],
    "unreportedWindow": "does-not-block",
    "noneReported": "overflow-to-cursor-002",
    "strict": false
  },
  "helpers": [
    {"model": "grok-4.7", "effort": "medium"},
    {"model": "composer-2.5"}
  ],
  "review": {
    "reviewerMustDifferFromAuthorFamily": true
  },
  "signInCheck": {
    "command": "codex cloud list --json --limit 1",
    "wrapper": "python3 scripts/codex/codex_orchestrator.py gate",
    "onLoggedOut": "stop-and-ask-carlos-for-device-code-sign-in"
  },
  "programs": []
}
